Title,Price1,product__pricing_area2
Pet Treat Bar Fresh Breath Biscuits | approx. 100g,$6.00,$60.00 per 1kg
Fancy Feast Inspirations Chicken Variety Cat Food 12x70g | 12 pack,$18.00,$2.14 per 100g
Woofin Good Beef Ear Dog Treat | 1 pack,,
,$22.00,$1.08 per 100g | Was $26.00 on Jul 2022
Fussy Cat Grain Free Twice as Tasty Adult Wet Cat Food Slices & Fish Jelly  | 12 pack,$12.50,$1.30 per 100g
Supercoat Senior With Fish Dry Dog Food | 2.6kg,$16.50,$0.63 per 100g
Purr Tender Chicken Breast in Gravy Cat Food | 85g,$1.20,$1.41 per 100g
,$0.90,$1.64 per 100g | Was $1.50
Woofin Good Chunks In Gravy Lamb & Veg Dog Food Pouch | 100g,$1.00,$1.00 per 100g | Was $1.50
Elevate Healthy Weight Cat Chicken Chunks With Carrot & Pumpkin In Gravy | 85g,$2.00,$2.35 per 100g
Woofin Good Chunks In Gravy Chicken Pasta & Veg Dog Food | 400g,$2.00,$0.50 per 100g | Was $2.40 on Sep 2021
,$1.75,$0.44 per 100g | Was $2.50
Nature's Gift Adult All Breeds Wet Dog Food Loaf Beef & Kidney With Chia | 100g,$1.30,$1.30 per 100g | Was $1.50 on Sep 2022
Nood Wild Caught Salmon Recipe With Garden Vegetables Dog Food | 100g,$2.00,$2.00 per 100g
Optimum Puppy Chicken Wet Dog Food Tray | 100g,$1.80,$1.80 per 100g
Coles Gold Fish Food Granules | 100g,$2.90,$2.90 per 100g
Coles Gold Fish Food Flakes | 36g,$3.80,$10.56 per 100g
,$3.50,$0.50 per 100g
,$3.50,$0.50 per 100g
Applaws Chicken Breast With Beef Liver & Vegetables Dog Food | 156g,$3.00,$1.92 per 100g
Coles Loaf Chicken Rice & Vegetable Dog Food | 1.2 kg,$2.95,$0.25 per 100g
Applaws Chicken Breast With Salmon & Vegetables Dog Food | 156g,$3.00,$1.92 per 100g
Bird Munchies Twin Pack Budgie Treat | 220g,$4.30,$1.95 per 100g
Golp Gourmet Puree Dog Or Cat Prebotic Topper | 130g,$4.00,$3.08 per 100g
Our Dog Tea Tree Oil Shampoo | 1L,$5.60,$5.60 per 1L
Farmers Market Grainfree Kitten Variety Cat Food 6x80g | 6 pack,$5.70,$1.19 per 100g | Was $9.50
Coles Gold Fish Food Flakes | 100g,$7.00,$7.00 per 100g
Temptations Seafood Medley Flavour Cat Treats | 85g,$5.00,$5.88 per 100g
Coles Dog Training Pads | 15 pack,$12.00,
Pedigree Homestyle Lamb Pasta & Vegies Adult Wet Dog Food Can | 1.2kg,$4.50,$0.38 per 100g | Was $5.50 on Oct 2022
Nature's Gift Strips Kangaroo Dog Food 100g | 6 pack,$5.00,$0.83 per 100g | Was $6.00 on Sep 2022
Purr Cat Food Seafood Jelly Selection 12x85g | 12 pack,$12.00,$1.18 per 100g
Dine Classic Collection Pouch Cat Food Fish Selection In Jelly 12x85g | 12 pack,$9.50,$0.93 per 100g | Was $14.00
Gourmet Delight Multipack Meaty Feast Cat Food 12x80g | 12 pack,$10.00,$1.04 per 100g | Was $12.00
Lux & Bones Interchangeable Cat Toy With Extendable 1m Pole | 1 pack,$15.00,$15.00 per 1ea
Harmony Lorikeet & Honey Eater Wild Bird Seed | 500g,$9.00,$1.80 per 100g
Woofin Good Dental Brush Medium Dog Treat | 10 pack,$15.00,$1.50 per 1ea
Nood Dry Cat Food Sustainable  Salmon Recipe With Probiotics | 1.5kg,$12.00,$0.80 per 100g | Was $16.50
Nood Wet Dog Food Grass Fed Beef & Lamb Recipe With Vegetables 12x100g | 12 pack,$12.50,$1.30 per 100g | Was $15.50
,$12.50,$1.30 per 100g
Lux And Bones Dog Treat Salmon & Chia Collagen Sticks | 7 pack,$14.00,$2.00 per 1ea
Pedigree Dentastix Small Dog Treats Daily Oral Care Dental Chews | 28 pack,$15.50,$0.55 per 1ea | Was $22.50
Friskies Meaty Grills | 2.5kg,$15.50,$0.62 per 100g
Friskies Dry Adult Seven Cat Food | 2.5kg,$15.50,$0.62 per 100g
Nood Dry Dog Food Cage Free Chicken Recipe With Superfoods | 3kg,$23.00,$0.77 per 100g
Optimum Adult 7+ Years Chicken Vegetable and Rice Dry Dog Food | 2.7Kg,$21.00,$0.78 per 100g
Whiskas So Meaty 1+ Years Wet Cat Food Meat Cuts In Gravy 85g Pouch | 24 pack,$20.50,$1.00 per 100g | Was $23.50 on Oct 2022
Pedigree Real Chicken Adult Dry Dog Food | 8kg,$28.00,$0.35 per 100g
Superfood Bites Beef | approx. 100g,$6.00,$60.00 per 1kg
Coles Bird Treat Budgie Canary Swing | 450g,$4.00,$0.89 per 100g
Woofin Good Chunks In Jelly Beef & Veg Dog Food Pouch | 100g,$1.00,$1.00 per 100g | Was $1.50
Crave  Adult Dog Food With Beef Pate | 100g,$1.40,$1.40 per 100g | Was $2.00
Fancy Feast Royale Broths Tuna Whitebait Cat Food | 40g,$1.80,$4.50 per 100g
,$2.00,$2.00 per 100g
Woofin Good Grainfree Chunks In Gravy Chicken & Vegetables Dog Food | 400g,$2.00,$0.50 per 100g | Was $2.40 on Sep 2021
Applaws Cat Food Pouch Tuna Wholemeat In Jelly | 70g,$2.20,$3.14 per 100g
Bow Wow Knot Rope Tug With Tennis Ball Toy | 1 pack,$5.00,$5.00 per 1ea
Optimum Mature 7+ Years Chunks In Jelly With Salmon Cat Food Pouch | 85g,$2.10,$2.47 per 100g
Bow Wow Waste Bags Bone Shaped Dispenser & Refill | 1 pack,$5.00,$5.00 per 1ea
Vitapet Litter Scoop With Rake | 1 each,$4.00,$4.00 per 1ea
Bow Wow Pals Squeaker Toy Hamburger & Hot Dog | 2 pack,$5.00,$2.50 per 1ea
Wag Filled Bone Small Dog Treat | 1 pack,$3.00,$3.00 per 1ea | Was $4.50
Fussy Cat Twice As Tasty Cat Food Pate & Pieces Chicken With Kangaroo | 70g,$2.50,$3.57 per 100g
Coles Cat Collar Reflective Medium | 1 pack,$5.00,$5.00 per 1ea
,$3.50,$0.50 per 100g
Coles Casserole Chicken Rice & Vegetable Dog Food | 1.2 kg,$2.95,$0.25 per 100g
Peters Twiggies Small Animal Treats | 150g,$5.00,$3.33 per 100g
Harmony No Waste Seed Mix | 1kg,$5.25,$0.53 per 100g | Was $7.00
,$11.00,$11.00 per 1ea
Peters Pasture Hay Bedding and Food | 1kg,$8.70,$0.87 per 100g
Friskies Kitten Discoveries Cat Food | 1kg,$7.00,$0.70 per 100g
Meat Mates Chicken Dog Dinner Grain Free Pouch Dog Food | 50g,$8.00,$16.00 per 100g
Vitapet Puppy Pee Training Pads | 7 pack,$11.00,$1.57 per 1ea
"Nerf ""Dog 2.5"" Squeak Tennis Ball Dog Toy"" | 4 pack",$15.00,$3.75 per 1ea
The Natural One Premium Bone Broth For Pets Free Range Chicken | 500mL,$8.00,$1.60 per 100mL
Dine Classic Collection Pouch Cat Food Succulent Selection In Jelly 12x85g | 12 pack,$9.50,$0.93 per 100g | Was $14.00
Pedigree Chunks In Gravy Beef Mvms Dog Food Pouch 12x85g | 12 pack,$10.00,$0.98 per 100g | Was $12.00
Coles Bird Seed Wildbird | 5kg,$9.95,$0.20 per 100g
Harmony Wild Bird Mix Bird Seed | 4kg,$9.50,$0.24 per 100g
Optimum With Chicken Rice Vegetables | 6 pack,$10.00,$1.67 per 100g
Purina Tidy Cats Litter Tray Deodoriser | 560g,$14.00,$25.00 per 1kg
Woofin Good Dog Treats Kangaroo Tails | 4 pack,$20.00,$5.00 per 1ea
Elevate Dry Dog Food Healthy Weight Chicken | 3kg,$26.00,$0.87 per 100g
Friskies Seafood Sensations Cat Food | 2.5kg,$15.50,$0.62 per 100g
,$18.00,$0.60 per 100g
Dine Daily Cat Food Fish Selection 85g | 14 pack,$15.50,$1.41 per 100g | Was $18.00 on Oct 2022
,$35.00,$0.50 per 100g
My Dog Classic Loaf With Tender Chicken 24X100G Wet Dog Food | 24 pack,$27.00,$1.13 per 100g | Was $36.00 on Oct 2022
Elanco Comfortis Plus Fleas Heartworm & Worms Medium Dog Treatment | 1 Pack,$37.00,$37.00 per 1ea
Purina Total Care Tasty Heartwormer & All Wormer Large Dog | 3 pack,$41.00,$13.67 per 1ea
Purina One Adult Dry Cat Food Healthy Salmon And Tuna | 1.5kg,$17.50,$1.17 per 100g
Whiskas Favourites Beef In Jelly Cat Food 12x85g | 12 pack,$11.00,$1.08 per 100g
Purr Cat Food Chickn Egg Veg In Gravy | 85g,$1.20,$1.41 per 100g
Woofin Good Chunks In Gravy Turkey & Veg Dog Food Pouch | 100g,$1.00,$1.00 per 100g | Was $1.50
Elevate Adult Dog Chicken Chunks With Peas & Sweet Potato In Gravy | 100g,$2.00,$2.00 per 100g
Crave  Adult Dog Food With Lamb & Turkey Pate | 100g,$1.40,$1.40 per 100g | Was $2.00
Dine Desire Pure Tuna Whitemeat Grain Free Wet Cat Food Can | 85g,$1.50,$1.76 per 100g | Was $2.15
Coles Budgie & Canary Treat With Honey | 1 pack,$2.00,$2.00 per 1ea
Optimum Grain Free Lamb & Green Beans Wet Dog Food Trays | 85g,$1.80,$2.12 per 100g
Pet Munchies Rabbit & Guinea Pig Treat | 300g,$2.30,$0.77 per 100g
Coles Budgie & Canary Bird Treats | 320g,$2.40,$0.75 per 100g
Coles Tropical Fish Food Flakes | 36g,$4.95,$13.75 per 100g
Applaws Chicken Breast Canned Dog Food | 156g,$3.00,$1.92 per 100g
Applaws Chicken Breast with Vegetables Canned Dog Food | 156g,$3.00,$1.92 per 100g
Purr  Cat Treat Chicken Calming | 50g,$3.50,$7.00 per 100g
Applaws Grainfree Ocean Fish With Salmon Dry Cat Food | 450g,$4.00,$0.89 per 100g | Was $5.00
Trill Vege Mix | 120g,$4.00,$3.33 per 100g
Vitapet Fish Water Ager | 125mL,$7.00,$7.00 per 1ea
Bird Munchies Gourmet Parrot Blend | 1 kg,$5.80,$0.58 per 100g
Purr Cat Food Meaty Selection 85g | 6 pack,$5.70,$1.12 per 100g
Premi-Yum Free Range Chicken Mince For Cats Cat Food 90g | 5 pack,$5.50,$1.22 per 100g
Coles Large Wild Bird Bird Seed | 2kg,$5.00,$0.25 per 100g
Pet Munchies Twin Pack Rabbit & Guinea Pig Treat | 180g,$5.95,$3.31 per 100g
Purr Singles Cat Food Chicken Selection 6x85g | 6 pack,$5.70,$1.12 per 100g
Nature's Gift Prime Beef In Gravy Dog Food 100g | 6 pack,$5.00,$0.83 per 100g | Was $6.00 on Sep 2022
Rufus & Coco Reel Fish Crunchers Cat Treat | 30g,$7.00,$23.33 per 100g | Was $10.00
Purr Meat Selection Cat Food 12X85g | 12 pack,$12.00,$1.18 per 100g
Trill Bird Seed Canary & Finch Mix | 1.8Kg,$6.00,
,$12.00,$12.00 per 1ea
Pedigree Adult Chunks In Gravy Beef Dog Food 12x85g | 12 pack,$10.00,$0.98 per 100g | Was $12.00
,$12.50,$1.04 per 100g | Was $15.50
,$12.50,$1.04 per 100g | Was $15.50
The Paw Grocer Freeze Dried Chicken Wing Tips Dog Treat | 90g,$13.00,$14.44 per 100g
The Paw Grocer Freeze Dried Salmon Belly With Fins Dog Treat | 90g,$13.00,$14.44 per 100g
My Dog Puppy Wet Dog Food Chicken Rice Carrots & Spinach 6X100g Trays | 6 pack,$9.50,$1.58 per 100g
Purina Total Care Flea Tick Control Plus Medium Dog Treatment | 1 pack,$14.00,$14.00 per 1ea | Was $20.00
,$14.00,$1.17 per 100g
,$14.00,$1.17 per 100g
Vitapet Jerhigh Chicken Sticks Dog Treats | 400g,$20.00,$5.00 per 100g
Purina Total Care Cat Treatment Heartwormer All Wormer Flea Control | 1 pack,$17.85,$17.85 per 1ea | Was $21.00
Nerf Dog TPR 3 Ring Tuff Tug | 1 pack,$20.00,$20.00 per 1ea
Supercoat True Origin Adult Dry Dog Food Salmon & Ocean Fish | 2.5 kg,$21.00,$0.84 per 100g
Purina Inspirations Salmon & Tuna Cat Food 12x70g | 12 pack,$18.00,$2.14 per 100g
Optimum Adult 1+ Years Wth Oceanfish Dry Cat Food | 2kg,$24.00,$1.20 per 100g
Purina Total Care Tasty Heartwormer & All Wormer Small Dog | 3 pack,$33.00,$11.00 per 1ea
Nature's Gift Adult All Breeds Dry Dog Food With Beef | 6kg,$21.00,$0.35 per 100g
Optimum Grainfree Dry Cat Food Sensitive Oceanfish | 1.8kg,$24.00,$1.33 per 100g
,$35.00,$0.50 per 100g
Optimum Dry Dog Food Adult Chicken Vegetable Rice | 7kg,$40.00,$0.57 per 100g
Nood Dry Dog Food Cage Free Chicken Recipe With Superfoods | 7kg,$42.00,$0.60 per 100g
Pedigree Dentastix Large Giant Dog Treat | 56 pack,$31.00,$0.55 per 1ea | Was $38.50 on Oct 2022
Coles Wild Bird Percher Treat | 750g,$5.50,$0.73 per 100g
Optimum Healthy Weight Chunks In Jelly Chicken Cat Food 12x85g | 12 pack,$19.00,$1.86 per 100g
Lux And Bones Dog Treat Chicken & Tumeric Collagen Sticks | 7 pack,$14.00,$2.00 per 1ea
Purina One Adult Healthy With Salmon & Tuna Dry Cat Food | 3kg,$31.00,$1.03 per 100g
Dine Classic Collections Pouch Cat Food Fish Selection In Jelly 24x85g | 24 pack,$22.00,$1.08 per 100g | Was $26.00 on Jul 2022
Dine Pulled Menu Gravy Indulgence Chicken Cat Food | 85g,$1.10,$1.29 per 100g | Was $1.60
Nature's Gift Adult All Breeds Wet Dog Food Loaf Succulent Lamb | 100g,$1.30,$1.30 per 100g | Was $1.50 on Sep 2022
Coles Dog Collar With Steel O Ring & Safety Clip Small | 1 pack,$5.00,$5.00 per 1ea
Meat Mates Beef Dog Dinner Grain Free Pouch Dog Food | 100g,$2.00,$2.00 per 100g
Coles Bird Treat Large Wild Bird | 300g,$2.40,$0.80 per 100g
Purina One Succulent Chicken In Gravy Hairball Cat Food Pouch | 70g,$2.20,$3.14 per 100g
Vitapet Fish Oxyshell | 1 pack,$3.70,$3.70 per 1ea
Purr  Cat Treat Chicken Joint | 50g,$3.50,$7.00 per 100g
Bow Wow Super Snacks Protein Bar Dog Treat Herring Apple & Pumpkin | 25g,$2.95,$11.80 per 100g
Trill Fruit & Nut Blend Bird Food | 200g,$4.50,$2.25 per 100g
Pet Munchies Gourmet Rabbit & Guinea Pig Blend | 1kg,$6.90,$0.69 per 100g
Pedigree Homestyle Chicken With Rice & Vegies Adult Wet Dog Food Can | 1.2kg,$4.50,$0.38 per 100g | Was $5.50 on Oct 2022
Elevate Dry Cat Food Hairball Chicken | 800g,$14.00,$1.75 per 100g
Elevate Dry Adult Cat Food Seafood & Rice With Sweet Potato | 800g,$14.00,$1.75 per 100g
Peters Alfalfa & Fruit Rabbit & Guinea Pig Food | 2kg,$6.60,$0.33 per 100g
Peters Timothy Hay Crunchies | 150g,$9.90,$6.60 per 100g
The Natural One Premium Bone Broth For Pets Grass Fed Beef | 500mL,$8.00,$1.60 per 100mL
Peters Oaten Hay Rabbit & Guinea Pig Food | 1 kg,$13.20,$1.32 per 100g
Golp Homestyle Chicken Veg & Brown Rice Dog Or Cat Prebiotic Topper | 300g,$9.50,$3.17 per 100g
Woofin Good Dental Brush Large Dog Treat | 5 pack,$15.00,$3.00 per 1ea
Purina Total Care Medicated Shampoo For Dogs | 350mL,$11.20,$32.00 per 1L | Was $16.00
,$13.00,$2.60 per 100mL
BX Earth Dog Gentle Puppy Coconut Oatmeal & Aloe Vera All Natural Shampoo | 500mL,$13.00,$2.60 per 100mL
Trill Lorikeet Complete Meal Mix | 500g,$10.00,$2.00 per 100g
Purina Total Care Cat Collar Reflective | 1 pack,$13.00,$13.00 per 1ea
Peters Brunch Rabbit & Guinea Pig Food | 450g,$15.50,$3.44 per 100g
Nood Wet Dog Food Grass Fed Beef Recipe With Vegetables 12x100g | 12 pack,$12.50,$1.04 per 100g | Was $15.50
"Nerf ""Dog 3.8"" Squeaker Or Squeak & Crunch Ball Dog Toy"" | 1 pack",$15.00,$15.00 per 1ea
,$21.00,$2.06 per 100g
Total Care Tasty Allwormer For Dogs | 4 pack,$17.00,$4.25 per 1ea
Schmackos Stix With Beef Dog Treats | 500g,$15.00,$3.00 per 100g
Nerf Blaster And Non-Squeak Tennis Ball | 3 pack,$25.00,$8.33 per 1ea
My Dog Classic Loaf With Gourmet Beef 24X100G Wet Dog Food | 24 pack,$27.00,$1.13 per 100g | Was $36.00 on Oct 2022
My Dog Adult Wet Dog Food Lamb Classic 100g Trays | 24 pack,$27.00,$1.13 per 100g | Was $36.00 on Oct 2022
Pet Treat Bar Pork Trotter Disks | approx. 100g,$6.00,$60.00 per 1kg
Pet Treat Bar Pork Femur | approx. 100g,$6.00,$60.00 per 1kg
Pet Treat Bar Inner Health Dog Biscuits | approx. 100g,$6.00,$60.00 per 1kg
Coles Cockatiel Bird Seed | 2kg,$5.00,$0.25 per 100g
Total Care Durasling Ball Dog Toy | 1 pack,$16.00,$16.00 per 1ea
Dine Saucy Morsels With Tuna And Cheese Wet Cat Food Tray | 85g,$0.95,$1.12 per 100g | Was $1.40
Elevate Digestive Support Dog Chicken Chunks With Peas & Pumpkin In Gravy | 100g,$2.00,$2.00 per 100g
Elevate Healthy Weight Dog Chicken Chunks With Peas & Sweet Potato In Gravy | 100g,$2.00,$2.00 per 100g
,$2.00,$2.35 per 100g
,$1.75,$2.06 per 100g
Nood Grass Fed Beef Recipe With Garden Vegetables Dog Food | 100g,$2.00,$2.00 per 100g
Peters Rabbit & Guinea Pig Crunchy Bar | 100g,$2.90,$2.90 per 100g
Meat Mates Chicken Dog Dinner Grain Free Pouch Dog Food | 100g,$2.00,$2.00 per 100g
Coles Adjustable Dog Collar Medium | 1 pack,$6.00,$6.00 per 1ea
Vitapet Fish Food Weekend Block | 1 each,$5.50,$5.50 per 1ea
﻿Coles Cat And Dog Double Bowl | 1 pack,$4.50,$4.50 per 1ea
Elevate Dry Cat Food Healthy Weight Chicken | 800g,$14.00,$1.75 per 100g
3M Lint Pet Roller | 1 each,$7.00,$7.00 per 1ea | Was $8.50
Vitapet Duck Tenders Dog Treat | 100g,$9.00,$9.00 per 100g
Coles Rectractable Lead | 1 pack,$16.50,$16.50 per 1ea
Woofin Good Peanut Butter Flavour Dog Treat Biscuits | 800g,$10.00,$1.25 per 100g
Lux & Bones Bush Magic Anti- Shedding/ Flaking- Skin & Coat Conditioner | 350mL,$15.00,$4.29 per 100mL
Lux & Bones Fur Fabulous Bright White Dog Shampoo | 350mL,$15.00,$4.29 per 100mL
Purina Total Care Flea Control Shampoo For Dogs | 350mL,$11.20,$32.00 per 1L | Was $16.00
,$13.00,$2.60 per 100mL
,$13.00,$2.60 per 100mL
Bird Munchies Wild Block Bird Treat | 1.4kg,$9.30,$0.66 per 100g
Purina Total Care Pom Pom Dangler Cat Toy | 1 pack,$13.00,$13.00 per 1ea
,$12.50,$1.04 per 100g | Was $15.50
Trill Small Bird Pellets | 600g,$10.00,$1.67 per 100g
Rufus & Coco Wee Away | 250mL,$12.80,$5.12 per 100mL | Was $16.00
Purr Chicken Selection Cat Food 12x85g | 12 pack,$12.00,$1.18 per 100g
Peters Poultry Mix Free Range | 5kg,$11.00,$0.22 per 100g
Purina Total Care Brush And Shine Dog | 1 pack,$13.60,$13.60 per 1ea
Purina Denta Life Chewy Dog Treat Small/Medium | 25 pack,$15.00,$0.60 per 1ea
Purina Total Care Flea Tick Control Plus Large Dog Treatment | 1 pack,$14.70,$14.70 per 1ea | Was $21.00
Nerf Catnip Blaster With 3 Catnip Discs | 1 pack,$18.00,$18.00 per 1ea
Nature's Gift Adult All Breeds Dry Dog Food With Kangaroo | 2.5kg,$10.50,$0.42 per 100g
Elevate Dry Dog Food Small Breed Lamb And Rice With Sweet Potato | 3kg,$26.00,$0.87 per 100g
Exelpet Fleaban House & Carpet Spray | 375mL,$19.00,$50.67 per 1L
,$20.85,$20.85 per 1ea | Was $24.50
Dine Daily Cat Food Meat Selection 14X85g | 14 pack,$15.50,$1.30 per 100g | Was $18.00 on Oct 2022
Optimum Natural Defence Skin And Coat Cat Food 12x85g | 12 pack,$19.00,$1.86 per 100g
Schmackos Strapz With Beef Dog Treats | 1kg,$22.50,$2.25 per 100g | Was $25.50 on Oct 2022
Purina Total Care Tasty Heartwormer & All Wormer Medium Dog | 3 pack,$36.00,$12.00 per 1ea
Optimum Adult With Beef Vegetables & Rice Dry Dog Food | 7kg,$40.00,$0.57 per 100g
Supercoat True Origin Salmon & Ocean Fish Adult Dry Dog Food | 7kg,$42.00,$0.60 per 100g
Pet Treat Bar Kangaroo Training Drops | approx. 100g,$6.00,$60.00 per 1kg
Pyramid Health Treats Chicken | approx. 100g,$6.00,$60.00 per 1kg
Coles Sunflower Bird Seed | 1.25kg,$5.30,$0.42 per 100g
Friskies Dry Cat Food Adult Indoor Delight | 2.5kg,$15.50,$0.62 per 100g
Coles With Ocean Fishadult Dry Cat Food With Ocean Fish | 1kg,$3.00,$0.30 per 100g
Dine Classic Collection Pouch Tuna In Jelly Cat Food | 85g,$0.95,$1.12 per 100g | Was $1.40
Elevate Adult Cat Chicken Chunks With Carrot & Pumpkin In Gravy | 85g,$2.00,$2.35 per 100g
"Nature's Gift ""Adult All Breeds Wet Dog Food Gravy | 100g",$1.30,$1.30 per 100g | Was $1.50 on Sep 2022
Nature's Gift Adult All Breeds Wet Dog Food Gravy With Kangaroo | 100g,$1.30,$1.30 per 100g | Was $1.50 on Sep 2022
Nature's Gift Adult All Breeds Wet Dog Food Loaf Chicken | 100g,$1.30,$1.30 per 100g | Was $1.50 on Sep 2022
Nood Cage Free Chicken Recipe With Garden Vegetables Dog Food | 100g,$2.00,$2.00 per 100g
Purina One Adult 1+Years Kitten Chicken Cat Food Pouch | 70g,$2.20,$3.14 per 100g
Coles Pet Wipes | 40 pack,$6.50,$0.16 per 1ea
Coles Dog Collar With Steel O Ring & Safety Clip Large | 1 pack,$7.00,$7.00 per 1ea
Whistler Tropical Fruit Lorikeet Bar | 100g,$3.50,$3.50 per 100g
,$3.95,$3.95 per 1ea
Vitapet Chewz Rawhide Alternative Roll With Chicken Pasta Dog Treat | 1 pack,$3.95,$3.95 per 1ea
Peters Rabbit & Guinea Pig Lucerne Pellets | 2kg,$6.70,$0.34 per 100g
Temptations Tantalising Turkey Flavour Cat Treats | 85g,$5.00,$5.88 per 100g
Vitapet Cat Litter Tray | 1 each,$7.50,$7.50 per 1ea
Elevate Dry Mature Chicken Cat Food | 800g,$14.00,$1.75 per 100g
Coles Dog Lead | 1 pack,$8.00,$8.00 per 1ea
Harmony No More Waste Wild Bird Block  | 330g,$5.00,$1.52 per 100g
,$6.40,$0.30 per 100g | Was $8.00
Dine Pulled Menu Gravy Indulgence Tuna Cat Food 7x85g | 7 pack,$7.50,$1.26 per 100g | Was $11.00
Lux And Bones Arthouse Collection Printed Collar Small | 1 pack,$14.00,$14.00 per 1ea
Lux And Bones Arthouse Collection Printed Bamboo Cat Bowl | 1 pack,$11.00,$11.00 per 1ea
Lux And Bones Arthouse Collection Printed Collar Medium | 1 pack,$15.00,$15.00 per 1ea
Peters Wormies Dried Mealworms | 100g,$12.00,$12.00 per 100g
Lux And Bones Arthouse Collection Printed Collar Large | 1 pack,$16.00,$16.00 per 1ea
Purina Total Care Flea Powder For Dogs | 200g,$9.35,$4.68 per 100g | Was $11.00
Coles Stainless Steel Bowl Non Skip Large | 1 pack,$12.00,$12.00 per 1ea
Lux And Bones Arthouse Collection Leash | 1 pack,$18.00,$18.00 per 1ea
Total Care Recyclaball Dog Toy | 1 pack,$12.00,$12.00 per 1ea
,$15.00,$4.29 per 100mL
Nerf Dog TPR Spike Ball | 1 pack,$12.00,$12.00 per 1ea
,$13.00,$6.50 per 100mL
Bird Munchies Sunflower Block Bird Treat | 880g,$9.30,$1.06 per 100g
Rufus & Coco 2 in 1 Oatmeal Wash | 200mL,$12.00,$60.00 per 1L | Was $15.00
Purina Total Care Bedding Fresh Spray | 275mL,$12.20,$4.44 per 100mL | Was $14.00
Bx Earth Dog Deodorising Cologne Spray Cherry Blossom | 250mL,$13.00,$5.20 per 100mL
Rufus & Coco Ear & Wound Care | 150mL,$12.40,$8.27 per 100mL | Was $15.50
Rufus & Coco Flea Flee Shampoo | 200mL,$12.40,$62.00 per 1L | Was $15.50
Purina Total Care Palatable Allwormer Cat Kittens Treatment Tablets | 2 pack,$12.75,$6.38 per 1ea | Was $15.00
Trill Large Bird Pellets | 600g,$10.00,$1.67 per 100g
Rascal Dog Treat Pump It Up - Roasted Pumpkin | 125g,$13.00,$10.40 per 100g
Rascal Dog Treat Date Night - Date Banana And Blueberry | 125g,$13.00,$10.40 per 100g
Purina Total Care Flea Tick Control Plus Small Dog Treatment | 1 pack,$13.30,$13.30 per 1ea | Was $19.00
Purina Total Care Tasty All Wormer Small Dog Or Puppies Treatment | 1 pack,$13.00,$13.00 per 1ea
Purina Total Care Knot Remover & Flea Comb Dog | 1 pack,$13.60,$13.60 per 1ea | Was $16.00
Purina Total Care Nail Clippers Dog | 1 pack,$13.60,$13.60 per 1ea | Was $16.00
Rufus & Coco Eco Pee Mat | 1 pack,$13.60,$13.60 per 1ea | Was $17.00
Greenies Original Dog Treat Petite | 170g,$14.00,$8.24 per 100g | Was $18.00
Purina Total Care Flea Control Plus Cat Treatment | 1 pack,$14.00,$14.00 per 1ea | Was $20.00
Rufus & Coco Antiseptic Aid | 75g,$14.40,| Was $18.00
,$21.00,$1.75 per 100g
Marvel Spiderman Plush Dog Toy | 1 pack,$14.70,$14.70 per 1ea | Was $21.00
Lux And Bones Luxury Collection Macrame Leash | 1 pack,$22.50,$22.50 per 1ea
Coles Cat Litter Recycled Paper | 21L,$21.00,$1.00 per 1L
Back To Nature Small Animal Bedding & Litter | 10L,$15.00,$0.15 per 100mL
Total Care Flea Knockdown for Medium & Large Dogs | 3 pack,$18.00,$6.00 per 1ea
Purina Total Care Dog Collar Reflective Medium | 1 pack,$20.00,$20.00 per 1ea
Friskies Dry Adult Surfin & Turfin Favourites Cat Food | 2.5kg,$15.50,$0.62 per 100g
Lux And Bones Harness & Leash Small Set | 1 pack,$25.00,$25.00 per 1ea
,$22.10,$22.10 per 1ea | Was $26.00
Nature's Gift Adult All Breeds Dry Dog Food With Kangaroo | 6kg,$21.00,$0.35 per 100g
Elevate Dry Dog Food Large Breed Chicken | 8kg,$45.00,$0.56 per 100g
Elanco Comfortis Plus Fleas Heartworm & Worms Small Dog Treatment | 1 Pack,$37.00,$37.00 per 1ea
Optimum Lamb And Rice Dog Food With Trays 24x100g | 24 pack,$28.50,$1.19 per 100g
Optimum Grain Free With Chicken & Vegetables Dry Dog Food | 6.5kg,$40.00,$0.62 per 100g
Elanco Comfortis Plus Fleas Heartwormer & Worms Large Dog Treatment | 1 pack,$37.00,$37.00 per 1ea
Pet Treat Bar Semi Moist Liver Bites | approx. 100g,$6.00,$60.00 per 1kg
Pet Treat Bar Liver Training Drops | approx. 100g,$6.00,$60.00 per 1kg
Pyramid Health Treats Kangaroo | approx. 100g,$6.00,$60.00 per 1kg
Pet Treat Bar Booster Chew Veggie | approx. 100g,$6.00,$60.00 per 1kg
Pet Treat Bar Sprinkle Donut | approx. 100g,,
Pet Treat Bar Love Biscuits Berry | approx. 100g,,
Pet Treat Bar Carob Cookies | approx. 100g,$5.50,$55.00 per 1kg
Pet Treat Bar Liver & Charcoal Dental Sticks | approx. 100g,,
"Purina Total Care Flea Knockdown for Cats, Puppies & Small Dog | 3 pack",$16.00,$5.33 per 1ea
Purina One Senior 7+ Dry Cat Food Chicken | 1.4kg,$17.50,$1.25 per 100g
"Purina Total Care Flea Knockdown for Cats, Puppies & Small Dog | 3 pack",$16.00,$5.33 per 1ea
Purina One Senior 7+ Dry Cat Food Chicken | 1.4kg,$17.50,$1.25 per 100g
Coles Soda Water | 1.25L,$1.00,$0.80 per 1L
,$7.00,$5.83 per 1L
Schweppes Mixers Soda Water Multipack Bottles 300mL | 4 pack,$7.00,$5.83 per 1L
Appletiser Sparkling Apple Juice Bottle   | 750mL,$3.15,$4.20 per 1L | Was $4.35
Bells Frozen Pure Bagged Ice | 5kg,$5.40,$1.08 per 1kg
Schweppes Dry Ginger Ale Classic Mixers Multipack Bottles 300mL | 4 pack,$7.00,$5.83 per 1L
Schweppes Mixers Tonic Water Multipack Bottles 300mL | 4 pack,$7.00,$5.83 per 1L
Schweppes Bitter Lemon Flavour Mixer Bottles 300mL | 4 pack,$7.00,$5.83 per 1L
Grapetiser Sparkling Red Grape Juice Bottle | 750mL,$3.15,$4.20 per 1L | Was $4.80
Coles Tonic Water | 1.25L,$1.00,$0.80 per 1L
Coles Dry Ginger Ale | 1.25L,$1.00,$0.80 per 1L
Straten Large Cups | 20 pack,$3.50,$0.18 per 1ea
Bundaberg Traditional Lemonade Multipack Bottles 375mL | 4 pack,$7.00,$4.67 per 1L
Schweppes Tonic Water Mixers Multipack Bottles 300mL | 4 pack,$7.00,$5.83 per 1L
Straten Small Cups 250mL | 20 pack,$2.50,$0.13 per 1ea
Coles Mixer Diet Dry Ginger Ale | 1.25L,$1.00,$0.80 per 1L
Straten Large Cups 400mL | 50 pack,$6.50,$0.13 per 1ea
Straten Small Cups 250mL | 50 pack,$5.00,$0.10 per 1ea
Coles Paper Bowls | 20 pack,$1.50,$0.08 per 1ea
Coles Paper Bowls | 50 pack,$3.15,$0.06 per 1ea
Straten Small Patterned Cups | 20 pack,$3.50,$0.18 per 1ea
Straten Large Patterned Cups 400mL | 20 pack,$4.50,$0.23 per 1ea
Straten Red Mini Paper Cups | 50 pack,$4.50,$9.00 per 100ea
,$7.00,$5.83 per 1L
Carlton Zero Alcohol Beer Cans 4x375mL | 4 pack,$7.55,$5.03 per 1L
Coles Picnic Reusable Tumblers | 4 pack,$4.50,$1.13 per 1ea
Edenvale Non Alcoholic Sparkling Cuvee | 750mL,$8.50,$11.33 per 1L | Was $10.50
Naked Llife Non Alcoholic Cocktail Margarita 4x250mL | 4 pack,$11.95,$11.95 per 1L | Was $14.95
Naked Life Non Alcoholic Cocktail Gin Tonic | 4 pack,$11.95,$2.99 per 1ea | Was $14.95
Great Northern Zero Can 6x375mL | 6 pack,$12.00,$5.33 per 1L
Coopers Ultra Light Drink Bottle 6x375mL | 6 pack,$11.00,$4.89 per 1L
Naked Life Non Alcoholic Cocktail Italian Spritz | 4 pack,$11.95,$2.99 per 1ea | Was $14.95
Naked Life Non Alcoholic Mojito Spritz Cocktail 4x250mL | 4 pack,$11.95,$11.95 per 1L | Was $14.95
Heineken 0.0 Bottle 330mL | 6 pack,$48.00,$24.24 per 1L
Edenvale Non Alcoholic Drink Sauvignon Blanc | 750mL,$8.50,$11.33 per 1L | Was $10.50
McGuigan Zero Alcohol Dry Rose | 750mL,$10.00,$13.33 per 1L
McGuigan Zero Alcohol Chardonnay | 750mL,$10.00,$13.33 per 1L
4 Pines Ultra Low Cans 4x375mL | 4 pack,$12.00,$8.00 per 1L
Hardys Zero Shiraz 750mL | 1 each,$13.00,$17.33 per 1L
Heaps Normal Quiet Non Alcoholic XPA 375mL | 4 pack,$15.00,$10.00 per 1L
