Title,Price1,product__pricing_area2
Naturopathica Gastro Health Daily Care Probiotic 15B Capsules | 30 Pack,$20.00,$0.67 per 1ea | Was $29.50 on Jul 2022
Nitwits Headlice All In One Treatment Spray | 120mL,$23.00,$19.17 per 100mL
Nivea Cellular Antiage Night Cream | 50mL,$33.00,$66.00 per 100mL
Blackmores CoQ10 150mg Heart Health Capsules | 30 pack,$27.00,$90.00 per 100ea
Revlon Photoready Rose Glow Primer | 30mL,$32.00,$10.67 per 10mL
Clearblue Ovulation Test Advanced | 10 pack,$40.00,$4.00 per 1ea
L'Oreal Excellence Light Golden Blonde 9.3 | 1 pack,$24.00,$24.00 per 1ea
Swisse Ultiboost Immune Gummies | 60 pack,$15.00,$0.25 per 1ea | Was $25.00 on Sep 2022
Garnier Green Labs Replumping Serum Cream | 72mL,$27.00,$37.50 per 100mL
Nicorette Quit Smoking Regular Strength Nicotine Gum Classic | 75 pack,$30.00,$30.00 per 1ea
Life-Space Baby Probiotic Powder | 40g,$28.00,$70.00 per 100g
Nature's Way Glucosamine + Chondroitin Tablets | 90 pack,$30.00,$0.33 per 1ea
Swisse Calcium & Vitamin D Tablets | 150 pack,$17.00,$0.11 per 1ea | Was $30.00 on May 2022
Invisible Zinc Sheer Defence Tinted Moisturiser SPF 50 Light | 50g,$34.00,$68.00 per 100g
Swisse High Strength Magnesium Powder Orange | 180g,$30.00,$16.67 per 100g
Gillette Proglide Power Red Blades | 4 pack,$38.50,$9.63 per 1ea
Maybelline Nudes Of New York Eyeshadow Palette | 1 each,$35.00,$35.00 per 1ea
Nature's Way Glucosamine + Chondroitin + MSM Tablets | 60 pack,$31.50,$0.53 per 1ea
Benefiber Powder | 500g,$29.00,$5.80 per 100g
Gillette Fusion Proshield Razor Blades | 4 pack,$38.50,$9.63 per 1ea
Revlon Colorstay Pressed Powder Light Medium | 8.4g,$35.00,$41.67 per 10g
Blackmores Probiotics+ Women's Flora Balance | 30 pack,$33.00,$110.00 per 100ea
L'Oreal Revitalift Moisturiser SPF 15 | 50mL,$37.00,$74.00 per 100mL
Swisse Ultiboost Relax & Sleep 60 Tablets  | 1 pack,$34.00,$34.00 per 1ea
Natures Way Way Restore Probiotic 50 Billion | 30 pack,$37.00,$1.23 per 1ea
Nature's Way Beauty Collagen Mature Skin Verisol Collagen + Vitamin A | 60 pack,$36.00,$0.60 per 1ea
L'Oreal Paris Age Perfect Eye Cream | 15mL,$37.00,$24.67 per 10mL
L'Oreal Paris Revitalift Night Cream | 50mL,$37.00,$74.00 per 100mL
Tom Organic The Period Cup Size 2 | 1 each,$42.00,$42.00 per 1ea
Swisse Ultivite Men's High Potency Multivitamin | 40 pack,$34.00,$0.85 per 1ea
Oral B Sensitive Brush Head Refills | 6 pack,$40.00,$6.67 per 1ea
Vs The Clean Cut For Men | 1 pack,$34.50,$34.50 per 1ea
Nature's Way Vitamin C 500mg Chewable Tablets | 500 pack,$29.00,$0.06 per 1ea
Oral B Whte Emulsions Apply Boost Light | 1 pack,$50.00,$25.00 per 1ea | Was $100.00
Nature's Own Super Vitamin B Complex Tablets W. Biotin + B12 | 150 pack,$37.00,$0.25 per 1ea
Nicabate Extra Fresh Mint Gum Quit Smoking 4mg | 100 pack,$31.00,$0.31 per 1ea | Was $36.00 on Nov 2022
L'Oreal Age Perfect Gold Age Night Cream | 50mL,$40.00,$80.00 per 100mL
Blackmores Executive B Stress Support Tablets | 125 pack,$39.00,$31.20 per 100ea
Nicorette Quit Smoking QuickMist Nicotine Mouth Spray Freshmint | 1 Pack,$40.00,$40.00 per 1ea | Was $45.00
Swisse Ultivite Men's Multivitamin Tablets | 60 pack,$30.00,$50.00 per 100ea
Swisse High Strength C | 150 Pack,$40.00,$0.27 per 1ea
Swisse Ultiboost Sleep Tablets | 100 pack,$40.00,$0.40 per 1ea
L'Oreal Revitalift Ginseng Glow Energising Day Cream | 50mL,$39.00,$78.00 per 100mL
Blackmores Macu Vision Eye Care Vitamin Tablets | 125 pack,$29.00,$0.23 per 1ea | Was $42.00 on Nov 2022
Swisse Ultiboost Magnesium 150mg 200 Tablets | 1 pack,$42.00,$42.00 per 1ea
﻿Braun Face Mini Hair Remover | 1 each,$50.00,$50.00 per 1ea
Herron Nicaway Mini Lozenges 2mg | 162 pack,$45.00,$0.28 per 1ea
L'Oreal Revitalift Laser Anti-Aging Power Moisturiser | 50mL,$50.00,$100.00 per 100mL
Metamucil Fibre Caps | 300 pack,$49.00,$0.16 per 1ea | Was $50.00
Nicabate Extra Fresh Mint Nicotine Chewing Gum 4mg | 200 pack,$44.00,$0.22 per 1ea | Was $49.00 on Nov 2022
Blackmores Glucosamine Sulfate 1500mg Tablets | 150 Pack,$45.00,$0.30 per 1ea
L'Oreal Age Perfect Cell Renewal Regenerating Eye Serum | 15mL,$50.00,$333.36 per 100mL
Gillette Proglide Power Red Flexball Razor Blades | 8 pack,$60.00,$7.50 per 1ea
L'Oreal Revitalift Filler SPF 15 Day Moisturiser | 50mL,$50.00,$100.00 per 100mL
Swisse Ultiboost Lemon & Honey Magnesium + Sleep Powder | 180g,$41.00,$22.78 per 100g
Piksters HydroPik Water Flosser | 1 pack,$70.00,$70.00 per 1ea | Was $100.00
Gillette Fusion Proshield Razor Blades | 8 pack,$60.00,$7.50 per 1ea
King C Gillette Beard Trimmer | 1 each,$60.00,$60.00 per 1ea
L'Oreal Revitalift Laser Renew Serum | 30mL,$55.00,$183.34 per 100mL
Braun Beard Trimmer | 1 pack,$60.00,$60.00 per 1ea
L'Oreal Paris Revitalift Laser Pure Retinol Night Serum | 30mL,$60.00,$200.01 per 100mL
Swisse Ultivite Women's 50+ Tablets | 90 pack,$60.00,$66.67 per 100ea
Vital All In One Daily Health Supplement | 300g,$60.00,$20.00 per 100g
Swisse Ultiboost High Strength Cranberry Tablets | 90 pack,$37.00,$0.41 per 1ea | Was $59.00 on May 2022
Nicorette Quickmist Smart Track | 2 pack,$75.00,$37.50 per 1ea
Dove Men+Care Shampoo Anti Dandruff | 300mL,$5.50,$1.83 per 100mL | Was $7.50 on Nov 2022
Nair Sensitive Pain Reducing Wax | 400g,$22.00,$5.50 per 100g
Herbal Essences Moroccan My Shine Shampoo | 300mL,$7.00,$2.33 per 100mL
Vicks Vapodrop + Cough Orange Menthol Lozenges | 36 pack,$9.00,$0.25 per 1ea
Revlon Colorstay Pressed Powder Medium | 8.4g,$35.00,$41.67 per 10g
Garnier Fructis Nourishing Banana Hair Food | 390mL,$14.00,$3.59 per 100mL
Thankyou Botanical Lime & Coriander Hand Wash Refill | 1L,$12.50,$1.25 per 100mL
Elastoplast Sport Rigid Strapping Tape | 1 pack,$13.00,$13.00 per 1ea
Thankyou Botanical Lemon Myrtle & Goat's Milk Body Wash | 1L,$13.00,$13.00 per 1L
VS Sassoon Mini Pro Straightener | 1 pack,$15.50,$15.50 per 1ea
Eylure Volume Pre-glued Eye Lashes | 1 pack,$11.50,$11.50 per 1ea
Conair Toiletry Bag Fabric Lined | 1 pack,$12.00,$12.00 per 1ea
Garnier Fructis Hydrating Aloevera Hair Food | 390mL,$14.00,$3.59 per 100mL
Neue.Lab Shampoo Classic Care | 400mL,$3.00,$0.75 per 100mL
Toni & Guy Strengthplex Conditioner | 50mL,$5.00,$10.00 per 100mL
Ostelin Cal-DK2 Calcium + Vitamin D Tablets D3 For Bones | 60 pack,$40.00,$66.67 per 100ea
Lush Aloe Vera Lubricant | 200mL,$10.00,$5.00 per 100mL
Dermal Therapy Heel Magic | 70g,$14.00,$20.00 per 100g
KOi Finger Lime & Patchouli Hand Cream | 100mL,$8.00,$8.00 per 100mL
Schwarzkopf Extra Care Normal Balance Leave In Treatment | 150mL,$12.00,$8.00 per 100mL
Garnier  Fructis 10-In-1 Nutri Repair Treatment | 1 pack,$12.00,$12.00 per 1ea
Naked Passion Water Based Lubricant Peppermint | 200mL,$10.00,$5.00 per 100mL
Skyn Pulse Device Plus Lubricant | 1 each,$20.00,$20.00 per 1ea
First Response 14 Day Ovulation Kit | 1 pack,$50.00,$50.00 per 1ea
Swisse Ub Iron + Probiotic Capsules | 30 pack,$22.50,$0.75 per 1ea
Swisse Ub Vitamin C + Zinc Powder Orange | 150g,$33.00,$22.00 per 100g
Schwarzkopf Simply Colour 4.65 Mocha Brown | 1 pack,$20.00,$20.00 per 1ea
Helios Ultra Hold Nail Glue 2.7mL | 1 pack,$6.00,$222.22 per 100mL
Reef SPF 50+ Sun Tan Coconut Oil Sunscreen Spray | 220mL,,
Garnier Fructis Watermelon Conditioner | 350mL,$12.00,$3.43 per 100mL
Hask Shampoo Curl Care Moisturizing | 355mL,$17.00,$4.79 per 100mL
Hask Conditioner Curl Care Detangling | 355mL,$17.00,$4.79 per 100mL
Gillette 5 Aqua Razor Cartridges | 4 pack,$25.50,$6.38 per 1ea
Glow Lab Shampoo Repairing | 300mL,$20.00,$6.67 per 100mL
Glow Lab Shampoo Purple | 300mL,$20.00,$6.67 per 100mL
Glow Lab Hydrating Conditioner | 300mL,$20.00,$6.67 per 100mL
Glow Lab Conditioner Purple | 300mL,$20.00,$6.67 per 100mL
Glow Lab Hydrating Conditioner | 600mL,$33.00,$5.50 per 100mL
Glow Lab Conditioner Repairing | 600mL,$33.00,$5.50 per 100mL
Glow Lab Leave In Conditioner | 120mL,$20.00,$16.67 per 100mL
Veet Pure Cold Leg Wax Strips | 20 pack,$12.00,$0.60 per 1ea
Nair Soft Natural Wax Strips | 40 pack,$16.00,$0.40 per 1ea
Nad's Natural Body Wax Strips | 60 pack,$20.00,$0.33 per 1ea
1000 Hour 3d Lash Queenie #561 | 1 pack,$12.95,$12.95 per 1ea
Nad's Hair Removal Face Butter | 60mL,$9.00,$15.00 per 100mL
Swisse UB Super Strength Fish Oil 2000Mg Capsules | 200 pack,$35.00,$0.18 per 1ea
Swisse UB Calm + De-Stress Tablets | 60 pack,$30.00,$0.50 per 1ea
Swisse UB Multivitamin Gummies | 60 pack,$15.00,$0.25 per 1ea | Was $25.00 on Sep 2022
Blackmores Stress + Sleep Vitamin B Tablets | 20 pack,$15.00,$0.75 per 1ea
Blackmores B12 Rapi-Melt Energy Support Vitamin B | 60 pack,$25.00,$0.42 per 1ea
Oral B Cross Action Electric Brush Replacement Head | 3 pack,$25.50,$5.10 per 1ea
L'Oreal Age Perfect Cr Midnight Serum | 30mL,$60.00,$200.01 per 100mL
Maybelline Superstay 30H Light Concealer | 6mL,$25.00,$41.67 per 10mL
Nivea Cellular Lift Expert Day Cream | 50mL,$35.00,$70.00 per 100mL
Pantene Nutrient Blends Illuminating Colour Care Jojoba Oil Shampoo | 270mL,$18.00,$6.67 per 100mL
Pantene Nutrient Blends Miracle Moisture Boost Rosewater Shampoo | 270mL,$18.00,$6.67 per 100mL
,$18.00,$7.20 per 100mL
,$18.00,$7.20 per 100mL
Ultra Life Effervescent Immune Orange Tablets | 60 pack,$30.00,$0.50 per 1ea
Ultra Life Effervescent Magnesium Lemon Tablets | 60 pack,$30.00,$0.50 per 1ea
Ultra Life Effervescent Multivitamin Orange Tablets | 60 pack,$30.00,$0.50 per 1ea
Oil Garden Ultrasonic Diffuser | 1 each,$35.00,$35.00 per 1ea
Schwarzkopf Extra Care Ultimate Repair Shampoo Refill | 1.2L,$22.00,$1.83 per 100mL
Schwarzkopf Extra Care Ultimate Repair Conditioner Refill | 1.2L,$22.00,$1.83 per 100mL
Revlon Colorstay Normal/Dry Longwear Makeup Sand Beige | 30mL,$37.00,$12.33 per 10mL
Revlon Colorstay Normal/Dry Longwear Makeup Medium Beige | 30mL,$37.00,$12.33 per 10mL
Maybelline Sky High Mascara Cosmic Black | 7.2mL,$26.00,$36.11 per 10mL
Schwarzkopf Got2b 4 Brows & Edges | 16mL,$21.00,$131.25 per 100mL
Barber & Co Texturising Spray | 180mL,$17.00,$9.44 per 100mL
Ocean Australia Natural Body Sunscreen SPF50+ | 120g,$25.00,$20.83 per 100g
Glow Lab Hand Wash Refill Amber & Sage | 900mL,$18.00,$2.00 per 100mL
Palmolive Body Wash Skin Food Desert Lime | 1L,$15.00,$1.50 per 100mL
Schwarzkopf Live Colour Ultra Brights Electric Blue | 75mL,$14.00,$18.67 per 100mL
Schwarzkopf Live Colour Permanent Silver Storm | 1 pack,$15.00,$15.00 per 1ea
Schwarzkopf Live Colour Permanent 1.0 Black | 1 pack,$15.00,$15.00 per 1ea
Schwarzkopf Live Colour Permanent 4.45 Rich Chocolate | 1 pack,$15.00,$15.00 per 1ea
Clairol Nice'N Easy 9.5A Baby Blonde | 1 pack,$9.70,$9.70 per 1ea | Was $14.00 on Oct 2022
Clairol Nice'N Easy 9B Light Beige Blonde | 1 pack,$9.70,$9.70 per 1ea | Was $14.00 on Oct 2022
Clairol Nice'N Easy 3.5 Darkest Brown | 1 pack,$9.70,$9.70 per 1ea | Was $14.00 on Oct 2022
Anihana Bath Bomb Peach Smoothie | 180g,$8.00,$4.44 per 100g
Clairol Nice'N Easy 7 Dark Blonde | 1 pack,$9.70,$9.70 per 1ea | Was $14.00 on Oct 2022
Clairol Nice'N Easy 8WR Golden Auburn | 1 pack,$9.70,$9.70 per 1ea | Was $14.00 on Oct 2022
Brutal Truth Deodorant Spray Antiperspirant Rustic Woody | 150mL,$12.00,$8.00 per 100mL
Ultra Life Mens Multivitamins | 120 pack,$30.00,$0.25 per 1ea
Blackmores Omega Brain | 60 pack,$30.00,$0.50 per 1ea
Natures Way High Strength Gummies Sugar Free Probiotic | 65 pack,$25.00,$0.38 per 1ea
Nature Way Max Strength Apple Cider Vinegar 1200mg | 90 pack,$30.00,$0.33 per 1ea
Natures Way High Strength Gummies Sugar Free Sleep | 40 pack,$25.00,$0.63 per 1ea
Gillette Labs Shave Foam | 240mL,$12.00,$5.00 per 100mL
Quick Screen Facial Sunscreen Lotion SPF50+ | 45mL,$40.00,$88.89 per 100mL
Garnier Green Labs Retinol Berry Serum | 50mL,$35.00,$70.00 per 100mL
L'Oreal Wrinkle Expert SPF 15 Day Cream 45+ | 50mL,$18.00,$36.00 per 100mL | Was $24.00 on Nov 2022
Thayers Witch Hazel Rose Toner | 355mL,$17.00,$4.79 per 100mL
Thayers Witch Hazel Unscented Toner | 355mL,$17.00,$4.79 per 100mL
Thayers Witch Hazel Rose Toner Mist | 237mL,$17.00,$7.17 per 100mL
Nivea Sun Uv Sensitive Face SPF 50 | 50mL,$15.00,$30.00 per 100mL
Covergirl Simply Ageless Concealer Light | 7.3mL,$23.00,$31.51 per 10mL
Cetaphil Moisturising Lotion | 1L,$30.00,$3.00 per 100mL
Napro Palette 5-99 Rosewood Violet Permanent Hair Colour | 1 pack,$9.00,$9.00 per 1ea
Napro Palette 1-0 Black Permanent Hair Colour | 1 pack,$9.00,$9.00 per 1ea
Davinci Shaving Brush | 1 pack,$6.50,$6.50 per 1ea
Blackmores Folate 500mg Folic Acid Vitamin Tablets | 90 pack,$8.00,$0.09 per 1ea | Was $10.00 on Nov 2022
Elastoplast Knee Support | 1 each,$27.00,$27.00 per 1ea
Head & Shoulders Conditioner Clean Balanced | 200mL,$8.00,$4.00 per 100mL
Herbal Essences Bio Renew Argan Oil Hair Mask For Repair | 237mL,$9.00,$3.80 per 100mL | Was $18.00
Coles Face Roller | 1 pack,$15.00,$15.00 per 1ea
Manicare Eyes Expert Brush | 3 pack,$13.20,$4.40 per 1ea | Was $22.00
L'Oreal Paris Infallible More Than Concealer Ivory | 11mL,$19.20,$17.45 per 10mL | Was $32.00
Revlon Colorstay Ultimate Suede 045 Supermodel Lipstick | 2.55g,$27.00,$105.88 per 10g
Garnier Fructis Hair Food Watermelon | 390mL,$14.00,$3.59 per 100mL
Coles Travel Hair Brush | 1 pack,$6.70,$6.70 per 1ea
Coles Anti Bacterial Biodegradable Hand And Body Wipes | 30 pack,$2.60,$0.09 per 1ea
Coles Denture Toothbrush | 1 pack,$2.20,$2.20 per 1ea
Luca Hand Sanitiser | 50mL,$4.00,$8.00 per 100mL
Coles Crepe Bandage Medium | 1 each,$6.00,$6.00 per 1ea
Cottons Organic Maternity Pads | 10 pack,$2.75,$0.28 per 1ea | Was $5.50
Coles Cosmetic Headband | 1 pack,$5.00,$5.00 per 1ea
Coles SPF 50+ Sunscreen Ultra Tube | 100mL,$2.25,$2.25 per 100mL | Was $3.00 on Sep 2019
Urban Colour Liquid Foundation Ivory | 30mL,$5.50,$1.83 per 10mL
Urban Colour Liquid Foundation Beige | 30mL,$5.50,$1.83 per 10mL
KOi Soap Dish Bamboo | 1 each,$3.00,$3.00 per 1ea
U By Kotex Eco Regular Pad | 10 pack,$3.92,$0.39 per 1ea | Was $5.60
Nivea Rich Nourishing Body Lotion Moisturiser + Caring Almond Oil | 75mL,$3.00,$4.00 per 100mL
Anihana Soap Bar Raspberry & Lime | 100g,$4.00,$4.00 per 100g
Libra Cotton Pads Goodnights With Wings | 8 pack,$4.40,$0.55 per 1ea | Was $5.50
Headgear Styling Range Cruel Clay | 100g,$4.50,$4.50 per 100g | Was $9.00
Nyal Paracetamol Capsules | 20 pack,$3.50,$0.18 per 1ea
Coles Nasal Saline Solution | 30mL,$7.00,$23.33 per 100mL
One Of A Kind Facial Wax Strips Vanilla & Coconut | 20 pack,$10.00,$0.50 per 1ea
Anihana Scrub Bar Raspberry & Lime | 100g,$5.00,$5.00 per 100g
Voost Effervescent Multivitamin Berry Tablets | 20 pack,$5.40,$0.27 per 1ea | Was $9.00
Coles Eucalyptus Solution 10% | 200mL,$5.00,$2.50 per 100mL
Olay Sheet Mask Regenerist Niacinamide +Retinol 24 | 1 each,$5.50,$5.50 per 1ea | Was $11.00
Grow Longer Stronger Hair Mask | 50mL,$6.00,$12.00 per 100mL
Moments Ultra Thin Large Extra Lubricated Condoms | 12 pack,$7.00,$0.58 per 1ea
Moments Ultra Thin Extra Large Extra Lubricated Condoms | 12 pack,$7.00,$0.58 per 1ea
Dove Nourishing Secrets Lavender & Rose Roll On | 50mL,$4.50,$9.00 per 100mL
KOi Finger Lime & Patchouli Hand Wash | 500mL,$7.00,$1.40 per 100mL
Rocc Naturals B12 + Coconut Oil Toothpaste | 100g,$6.00,$6.00 per 100g
Brite Semi Permanent Colour Pink | 75mL,$6.00,$8.00 per 100mL | Was $10.00
Brite Semi Permanent Turquoise Hair Colour | 75mL,$6.00,$8.00 per 100mL | Was $10.00
Telfast Hayfever Allergy Relief 60mg Antihistamine Tablets | 10 pack,$6.00,$0.60 per 1ea | Was $7.35
Four Seasons Naked Closer Condoms | 12 pack,$7.00,$0.58 per 1ea
Toni & Guy Purple Conditioner | 50mL,$5.00,$10.00 per 100mL
Patch Sensitive Bamboo Plasters With Aloe Vera | 25 pack,$7.00,$0.28 per 1ea
Scunci Effortless Beauty Topsy Tail | 5 pack,$7.00,$1.40 per 1ea | Was $10.00
Panadol Mini Caps for Pain Relief Paracetamol 500mg | 20 pack,$4.70,$0.24 per 1ea
Audisol Dry Ears Spray | 30mL,$8.00,$26.67 per 100mL
Wet Ones Antibacterial Hand Wipes Be Fresh | 80 pack,$6.80,$0.09 per 1ea
Impulse Festival Summer Edition Body Spray | 75mL,$6.00,$8.00 per 100mL
Schick Intuition Island Berry Razor Kit | 1 pack,$7.50,$7.50 per 1ea | Was $15.00
Olay Total Effects Normal UV Cream Mini | 12g,$7.00,$58.33 per 100g
Schmidt's Deodorant Spray Rose & Vanilla | 115mL,$7.70,$6.70 per 100mL | Was $11.00
Schmidt's Deodorant Spray Lavender & Sage | 115mL,$7.70,$6.70 per 100mL | Was $11.00
Lady Jayne Tangle Pro Detangling Brush | 1 each,$7.80,$7.80 per 1ea | Was $14.80
Head & Shoulders Supreme Scalp Moisture & Smooth Shampoo | 400mL,$8.00,$2.00 per 100mL | Was $16.00
Essano Argan Oil Nourishing Shampoo | 300mL,$8.00,$2.67 per 100mL | Was $16.00
Sukin Rosehip Nourishing Cream Cleanser | 125mL,$8.00,$6.40 per 100mL | Was $16.00
Sukin Blemish Control Oil Free Moisturiser | 125mL,$8.00,$6.40 per 100mL | Was $16.00
Essano Blonde Conditioner | 300mL,$8.00,$2.67 per 100mL | Was $16.00
People Repair Shampoo | 350mL,$8.00,$2.29 per 100mL | Was $16.00
People Repair Conditioner | 350mL,$8.00,$2.29 per 100mL | Was $16.00
Essano Scalp Refresh Shampoo | 300mL,$8.00,$2.67 per 100mL | Was $16.00
Essano Scalp Refresh Conditioner | 300mL,$8.00,$2.67 per 100mL | Was $16.00
Centrum Kids Chewables Multi Fuel | 50 pack,$8.00,$0.16 per 1ea | Was $16.00
Sukin Teen Skin Super Scrub | 125mL,$8.00,$6.40 per 100mL | Was $16.00
Manuka Health Lemon & Ginger Flavoured Honey Lozenges | 15 pack,$7.00,$0.47 per 1ea
Bosisto's Nasal Spray Eucalyptus | 50mL,$8.00,$16.00 per 100mL
Sunsilk Shampoo Summer Care | 700mL,$12.00,$1.71 per 100mL
Clairol Root Touch Up No Ammonia 5 Medium Brown | 1 pack,$8.25,$8.25 per 1ea | Was $16.50
Rimmel Lasting Finish Lip Liner Eastend Pink | 4g,$8.40,$21.00 per 10g | Was $14.00
KOi Bergamot & Magnolia Body Lotion | 400mL,$12.00,$3.00 per 100mL
Schwarzkopf Extra Care Push Up Volume Lifting Shampoo | 400mL,$9.00,$2.25 per 100mL
,$9.00,$2.25 per 100mL
Schwarzkopf Extra Care Push Up Volume Lifting Conditioner | 400mL,$9.00,$2.25 per 100mL
Bondi Sands  SPF 50+ Lip Balm Coconut | 10g,$7.00,$70.00 per 100g
Imperial Leather After Shave Lotion | 100mL,$9.00,$9.00 per 100mL | Was $10.80
L'Oreal Paris Elvive Purple 10 In 1 Spray | 150mL,$9.00,$6.00 per 100mL | Was $15.00
Audisol Ear Wax Remover | 20mL,$12.90,$64.50 per 100mL
Quit Nits Kills Head+Body Lice Foam | 125mL,$9.00,$7.20 per 100mL
Myaura Rose Vanilla & Jasmine Organics Deodorant | 65g,$9.00,$13.85 per 100g
Skyn Excitation Condoms | 10 pack,$9.50,$0.95 per 1ea | Was $11.00
KOi Green Tea & Cucumber Shampoo Bar | 100g,$16.00,$16.00 per 100g
KOi Ginger & Lemongrass Shampoo Bar | 100g,$16.00,$16.00 per 100g
Rimmel Oh My Gloss #100 Love Bug - Carded | 6.5mL,$9.60,$14.77 per 10mL | Was $16.00
Schmidt's Signature Deodorant Stick Rose And Vanilla | 75g,$9.80,$13.07 per 100g | Was $14.00
Revlon Kiss Fresh Strawberry Balm | 2.6g,$8.00,$30.77 per 10g
Bosisto's Calming Solution | 100mL,$8.00,$8.00 per 100mL
Head & Shoulders Supreme Scalp Moisture & Smooth Shampoo | 550mL,$10.00,$1.82 per 100mL
Head & Shoulders Supreme Scalp Repair Moisture & Smooth Shampoo | 550mL,$10.00,$1.82 per 100mL | Was $20.00
Head & Shoulders Supreme Scalp Moisture & Smooth Conditioner | 550mL,$10.00,$1.82 per 100mL
Herbal Essences Argan Oil & Aloe Treatment | 100mL,$10.00,$10.00 per 100mL
Herbal Essences Aloe & Eucalyptus Conditioner | 350mL,$10.00,$2.86 per 100mL
Moosehead Grubby Putty | 80g,$10.00,$12.50 per 100g | Was $12.50
Moosehead Forming Fibre | 80g,$10.00,$12.50 per 100g | Was $12.50
Sup Collagen Hair Skin Nails Tablets | 60 pack,$10.00,$16.67 per 100ea | Was $20.00
Dermal Therapy Plantation Heel Balm | 75g,$10.00,$13.33 per 100g | Was $15.00
Kings Domain Hair Slick Pomade | 85g,$10.00,$11.76 per 100g | Was $16.00
Kings Domain 3-In-1 Shampoo Conditioner Body Wash | 375mL,$10.00,$2.67 per 100mL | Was $16.00
Sup Clear Skin | 30 pack,$10.00,$0.33 per 1ea | Was $20.00
SUP Ashwagandha Calm & Relax Gummies | 30 pack,$10.00,$0.33 per 1ea | Was $20.00
KOi Green Tea & Cucumber Conditioner Bar | 70g,$16.00,$22.86 per 100g
KOi Ginger & Lemongrass Conditioner Bar | 70g,$16.00,$22.86 per 100g
Manicare Face Powder Brush | 1 pack,$10.14,$10.14 per 1ea | Was $16.90
One Of A Kind Wax Melting Pot | 1 each,$20.00,$20.00 per 1ea
Rimmel Lasting Finish Primer | 30mL,$10.20,$3.40 per 10mL | Was $17.00
,$10.20,$10.20 per 1ea | Was $17.00
Rimmel Oh My Gloss Plump Lip Gloss Diamond Pop | 6.5mL,$10.20,$15.69 per 10mL | Was $17.00
Thankyou Lime & Coriander Hand Wash | 500mL,$7.50,$1.50 per 100mL
Scunci Scrunchie Twist & Dry Hair Turban | 2 pack,$10.45,$5.23 per 1ea | Was $14.95
One Of A Kind Roll On Oil Neroli & Jasmine Flower | 15mL,$12.00,$80.01 per 100mL
Beach Road Naturals Shampoo Rosewater | 500mL,$10.50,$2.10 per 100mL | Was $18.00
Beach Road Naturals Conditioner Rosewater | 500mL,$10.50,$2.10 per 100mL | Was $18.00
De-Gas Peppermint Capsules | 24 pack,$8.00,$0.33 per 1ea
Rimmel Lasting Radiance Concealer Classic Beige | 7mL,$10.80,$15.43 per 10mL | Was $18.00
Beach Road Natural Organic Rosewater Castile Body Wash | 1L,$10.80,$1.08 per 100mL | Was $18.00
Beach Road Naturals Body Wash Lemon | 1L,$10.80,$1.08 per 100mL | Was $18.00
Scholl Expert Care Dry Skin Foot Sock Mask | 1 pack,$7.00,$7.00 per 1ea
Schwarzkopf Got2B Ultra Glued Gel | 150mL,$11.00,$7.33 per 100mL
Coles Assure Pants For Men Large | 8 pack,$9.65,$1.21 per 1ea
Bosisto's Stress Aroma Mist | 125mL,$10.00,$8.00 per 100mL
,$9.00,$0.56 per 1ea
Rimmel Multi Tasker Concealer Fair | 10mL,$11.40,$11.40 per 10mL | Was $19.00
SUP Inner Glow Collagen | 30 pack,$11.50,$0.38 per 1ea | Was $23.00
Lady Jayne Tangle Pro Detangling Brush | 1 pack,$12.00,$12.00 per 1ea | Was $21.30
Schwarzkopf Extra Care Keratin Sea Salt Spray | 250mL,$12.00,$4.80 per 100mL | Was $13.00
Garnier Olia Hair Colour 10.1 Very Very Light Blonde | 1 pack,$12.00,$12.00 per 1ea | Was $20.00
Ultra Life Vitamin D | 400 pack,$30.00,$0.08 per 1ea
Tena Womens Pants Low Waist Noir Medium | 10 each,$12.32,$1.23 per 1ea | Was $17.60
Essano Scalp Refresh Serum | 50mL,$12.50,$25.00 per 100mL | Was $25.00
Rimmel Match Perfection Foundation Lght Nude 102 | 30mL,$12.60,$4.20 per 10mL | Was $21.00
Vush Feelin' Myself Intimate Gel | 100mL,$12.80,$12.80 per 100mL | Was $16.00
Zena Repair Conditioner | 300mL,$20.00,$6.67 per 100mL
Olay Regenerist Whip | 10g,$12.00,$120.00 per 100g
Garnier Intensive Restoring Hand Cream | 100mL,$9.00,$9.00 per 100mL
Rimmel Wonder'Luxe Volume Mascara Brown Black | 11mL,$13.20,$12.00 per 10mL | Was $22.00
L'Oreal Plump & Set Brow Artist Transparent | 4.6g,$13.20,$28.70 per 10g | Was $22.00
LPO Purify Foaming Gel Cleanser | 150mL,$15.00,
Bondi Sands Aloe Vera After Sun | 200mL,$10.00,$5.00 per 100mL
Dominate Rock Solid Wax | 95g,$13.00,$13.68 per 100g
Voost Vitamin C 1000mg 40 Blood Orange Effervescent Tablets | 2 pack,$12.00,$6.00 per 1ea | Was $13.75 on May 2022
Epzen Awaken Cleanse Invigorating Body Wash | 750mL,$13.60,$1.81 per 100mL | Was $17.00
L'Oreal True Match 2N Vanilla Concealer | 6.8mL,$13.80,$20.29 per 10mL | Was $23.00
L'Oreal Brow Artist Xpert Cool Brown Brow Pencil | 3g,$13.80,$46.00 per 10g | Was $23.00
L'Oreal True Match Concealer Cream Beige | 6.8mL,$13.80,$20.29 per 10mL | Was $23.00
L'Oreal True Match Concealer Rose Ivory | 6.8mL,$13.80,$20.29 per 10mL | Was $23.00
L'Oreal Paris Brow Artist Xpert 102 Cool Blonde | 3g,$13.80,$46.00 per 10g | Was $23.00
Gaviscon Extra Strength 500Mg Peppermint Tablets | 24 pack,$11.50,$0.48 per 1ea
Clearasil Daily Clear Blackhead Clearing Scrub | 150mL,$10.50,$7.00 per 100mL
Anihana Shampoo Bar Grapefruit & Chamomile | 65g,$14.00,$21.54 per 100g
Anihana Shampoo Bar Lavender & Rosemary | 65g,$14.00,$21.54 per 100g
Anihana Shampoo & Conditioner Bar Ocean Cruz 2 In 1 | 65g,$14.00,$21.54 per 100g
Anihana Conditioner Bar Grapefruit & Lime | 60g,$14.00,$23.33 per 100g
Anihana Conditioner Bar Lavender & Lemon | 60g,$14.00,$23.33 per 100g
U by Kotex Thinx Period Underwear Black Bikini Size 6-8 | 1 each,$14.00,$14.00 per 1ea | Was $20.00
U by Kotex Thinx Period Underwear Black Bikini Size 10 | 1 each,$14.00,$14.00 per 1ea | Was $20.00
Tigi Bed Head Shampoo L3 Resurrectio | 300mL,$14.00,$4.67 per 100mL | Was $20.00
Tigi Bed Head Conditioner L3 Resurrection | 300mL,$14.00,$4.67 per 100mL | Was $20.00
Rimmel Lasting Finish Foundation Soft Beige #200 | 30mL,$14.00,$4.67 per 10mL | Was $24.00
Rimmel Lasting Finish Liquid Foundation True Ivory | 30mL,$14.00,$4.67 per 10mL | Was $24.00
Schwarzkopf Got2B Beachmatt Matt Paste | 100mL,$14.00,$14.00 per 100mL
Cedar And Stone Hand Wash  Exfoliating Oneash Exfoliating | 500mL,$16.00,$3.20 per 100mL
Cedar And Stone Body Wash Smooth Operator | 500mL,$16.00,$3.20 per 100mL
Hask Monoi Coconut Conditioner | 355mL,$17.00,$4.79 per 100mL
Hask Biotin Boost Thickening Shampoo | 355mL,$17.00,$4.79 per 100mL
Hask Biotin Boost Thickening Conditioner | 355mL,$17.00,$4.79 per 100mL
LPO Purify Hydrating Mist Toner | 50mL,$15.00,$30.00 per 100mL
Schwarzkopf C3 Nordic Blonde Anti-Yellow Toner | 200mL,$13.00,$6.50 per 100mL
Thursday Plantation Calming &  Sleep Support Lavender Oil | 9mL,$14.40,$160.02 per 100mL | Was $20.00
Glow Lab Facial Moisturiser | 100mL,$16.00,$16.00 per 100mL
Brite Organix Vegan Bleach Kit | 1 pack,$14.40,$14.40 per 1ea | Was $18.00
Sukin Facial Moisturiser For Men | 225mL,$16.00,$7.11 per 100mL
Schick Hydro 5 Sensitive Razor Kit | 1 pack,$14.50,$14.50 per 1ea | Was $29.00
Brutal Truth Shower Gel Rustic Woody | 300mL,$13.00,$4.33 per 100mL
Tresemme Pro Pure Conditioner Radiant Colour | 675mL,$13.00,$1.93 per 100mL
Nivea Naturally Good Day Cream Radiance | 50mL,$12.00,$24.00 per 100mL
Sunsilk Sunsilk Conditioner Clean & Fresh | 700mL,$12.00,$1.71 per 100mL
L'Oreal Paris Color Riche Satin Lipstick 303 Rose Tendre | 3.3g,$15.00,$45.45 per 10g | Was $25.00
Libra Underwear Hipster Xs | 1 each,$15.00,$15.00 per 1ea | Was $25.00
Libra Underwear Hipster XL | 1 each,$15.00,$15.00 per 1ea | Was $25.00
